{"schemaVersion":2,"programId":"hepta-paper","planVersion":"1.1","truthStatus":"canonical_static","auditBaseline":{"repositoryId":1349108143,"repository":"TrillionniumFoundation/hepta-paper","ref":"codex/rust-plan-v4-rc1-20260831","commit":"b664b43c8caf0fa8513deee0bf3e7a9935afc4d8","tree":"3f4dd3dfc59785410bd98c190f65d184829dce11","auditedAt":"2026-09-01T10:11:30+08:00"},"currentStage":"global_documentation_rebuild_source_implemented","stateDimensions":{"implementation":["not_started","design_ready","source_implemented"],"qualification":["unqualified","source","hosted_installed","target_host","external_authority"],"activation":["disabled","shadow","canary","authoritative","retired"],"operation":["unknown","healthy","degraded","blocked"],"compatibility":["unassessed","exact","semantic","evaluation","retire"]},"authorityCeiling":{"rustProductionComposition":"absent","rustCampaignWriterActivation":"disabled","realCodexCredentials":"forbidden","liveProviderCalls":"forbidden","releaseAuthority":"absent","submissionAuthority":"absent","currentNodeControlPlane":"authoritative_under_existing_gates"},"canonicalDocuments":{"entry":"docs/README.md","status":"docs/system/CURRENT_STATUS.md","plan":"docs/system/MASTER_PLAN.md","architecture":"docs/system/ARCHITECTURE.md","backlog":"docs/system/BACKLOG.md","risks":"docs/system/RISK_REGISTER.md","invariants":"docs/system/INVARIANTS.md","documentationGovernance":"docs/system/DOCUMENTATION_GOVERNANCE.md","milestones":"docs/system/MILESTONE_GATES.md","traceability":"docs/system/TRACEABILITY.md"},"machineRecords":["docs/system/truth/program.v2.json","docs/system/truth/capabilities.v1.json","docs/system/truth/modules.v1.json","docs/system/truth/work-items.v2.json","docs/system/truth/milestones.v1.json","docs/system/truth/risks.v2.json","docs/system/truth/canonical-workloads.v1.json","docs/system/truth/document-manifest.v1.json","docs/system/truth/evidence-bindings.v1.json"],"activeSubplans":[{"name":"Rust control-plane migration","version":"4.1","path":"docs/rust/RUST_REWRITE_MASTER_PLAN.md","scope":"rust_source_and_authority_migration"}],"workstreamIds":["SYS","MOD","CTL","SCH","RES","PERF","OBS","ORG","FND","BRK","WS","CMP","RO","MVP","DB","EVD","REL","CUT"],"openCriticalGates":["G0","G1","G2","G3","G4","G5","G6","G7","G8","G9","G10"],"historicalDocumentPolicy":"git_history_only"}
